comment ,pick,state
"I'll tell you what's so dangerous and insidious about Tom Friedman's argument here. This argument plants the seed for shifting the blame and changing the narrative. Our economy can't go back to normal until we've tested the heck out of this virus the way Iceland and South Korea have, and then locked down our borders to nations that haven't. Getting to this state of affairs is going to take months longer than it should have, and the fault for that lies largely with the Trump administration and in particular its failure to ramp up the testing, including rejecting the German test that was successfully being used elsewhere. But what if we didn't have to wait until it was safe to go back to normal? What if there was a shortcut that required us to put millions at many times greater risk but offered the plausible deniability that it was their fault for not isolating themselves better? Then all this wouldn't have to be Trump's fault. It could be the nanny-state liberals and the know-it-alls coastal elitists who were holding back our economy and our lives from getting back to normal. If I were serving up the talking points for Fox News, I would be making this THE narrative. The only question is when.",Reader Picks,Washington
"There are plenty of smart people. We can insist that Trump listen to them..."" Unfortunately, Our President already addressed that, when he told Bloomberg that there wasn't anyone else smarter than himself.",Reader Picks,NC
"Careful there. The Spanish flu had two waves: The first, in early spring, killed mainly the elderly and sick (like the one we're dealing with now). It receded and many public officials believed it was over. The second wave, in the fall of 1918 killed millions, mostly young adults.",Reader Picks,USA
"With the best of intentions, Tom Friedman gets it wrong, again. The best solution is to ""flatten the curve"" to prevent overwhelming medical resources -- which has been show to increase mortality (see Italy; see China). The idea of providing ""herd immunity"" for the population by exposing the vast majority of them to a potentially fatal disease is simple insanity based on the idea that money is more important than people. You know the best way to provide ""herd immunity""? Keep as many people virus-free for as long as possible until a vaccine is available. Vaccination ALSO provides ""herd immunity"".",Reader Picks,Australia
"We shut down much of the economy precisely because we are unable to answer the key questions: exactly who is vulnerable to death or serious illness from covid-19 (which may do lasting damage to one?s lungs); and can people be reinfected? Along the lines of ?you go to war with the army you?ve got?, we need to face this epidemic without adequate testing, personal protective equipment, hospital capacity or ventilators. And that?s why we shut down a huge part of the economy. Our winner take all economy left too many vulnerable and now we?re all going to find out what that means. I hope we learn the right lessons. The people do not exist to service the economy. The economy exists to provide for the people.",Reader Picks,MA
"I am an old guy--but in Italy, most over 90 (far older than I am) do fine. Many relative youngsters, with risk factors or not get exceedingly sick also. (I read a tale of two hospital workers recently in the Wuhan area, both young women, both healthy who caught coronavirus. One died of Coronavirus, the other did not.) People with pre-existing conditions--especially lung damage, are very much at risk. Smokers may be a bigger risk factor than age. The Chinese quarantine worked! They are getting about 44 new cases a day--and it is holding constant. The South Koreans have also stabilized with far less coercive tactics, but are seeing a pretty steady new caseload, well within their medical establishment's ability to care for. As their caseloads stabilize and their ability to handle patients increases, both can further reduce restrictions. No restrictions means in 40 days, you have about 15 million sick people (minus a couple of million of the aged). How well will the 10% who need medical attention be treated when they arrive at hospitals all n the same week? (as they will) BTW, the science behind the COVID-19 virus and the first tests were all developed by the Chinese who immediately released it to the world. Had our government used that information (or just used the test developed by the Germans and given to the WHO), our testing would be 80 days ahead of where we are now.",Reader Picks,CA
"All true--but about 1%--3% of you would be dead from the virus, and another 5% or so would be dead because the millions who would all get sick the same week would swamp the system in about 40 days. Using social distancing for long enough to knock down the exponential growth should take a few weeks (3 or 4)(as it did in China and S. Korea). Then, with milder social distancing, keep the rate at a manageable level for the hospitals and medical teams until we get a vaccine or effective drug therapy. A few weeks of inconvenience could easily save a few million lives. What do you think of the trade-off.",Reader Picks,CA
"To those thinking a ""few"" deaths to the old is immaterial: Every 5 days the population of infected people doubles with a death rate of about 0.9%. With some 400 dead the US is somewhere between the 9th and 10th doubling. This means the virus has been around for about a month and a half coinciding with about the beginning of February. On the 11th doubling, about 8 or 9 days hence, you are looking at around 2,000 deaths. On the 17th doubling, some one and a bit months out, the number of deaths is around 350,000. The under 60 death rate is around 20% so you've got around 70,000 deaths of people under 60 one a bit months out. So the real issue with this contagion is that although the rates of death are small, the large population coupled with fast transmission means the number of deaths is large. In addition the need for ICU beds, respirators, and hospitalization could not cope. Is that your idea of a ""few""?",Reader Picks,CA
"This piece is interesting. I believe that saving the economy also saves lifes. But there is flaw in the general argument that shows near the end of the text: ""we shut down for months to try to save everyone everywhere from this virus ? no matter their risk profile ? and kill many people by other means, kill our economy and maybe kill our future."". Shutting down for weeks or months is NOT intended to ""save everyone, everywhere"". That would be unrealistic and naive. It is implicitly admmited in that approach that almost everyone will get the virus. It aims to avoid that too many people get it AT THE SAME TIME. Because if they do, the small percentage that would need treatment would nevertheless be too much for the health system to cope. And therefore lots of people would unneccessarily fue. As tempting as the ""two weeks isolation only"" sounds and even if it's undelying principle is correct, the logistics and challenges behind implementing any such approach are immense. It would demand high quality information being properly and quickly processed. We don't have either of those right now. Acquiring that information takes time. Unfortunately it also takes that more cases happen. However, if most of us do isolate right now and in honest, then we will have bought the time needed to ponder about the solutions to be adopted afterwards. So please, stay home untill it is safe for you to go out again. That will be decided in due time for those who are experts on the matter.",Reader Picks,Brazil
"Of course, Americans will rail against the socialist principles needed to take care of their weakest, physically and economically speaking, even in terrifying times likes these. But for goodness sake try to, even for a little while. While initially advocating ""herd immunity"" here in the UK, the British Government is now paying 80% of workers' salaries up to 2500 per month for the foreseeable so that people can afford to do the right thing, stay at home, to avoid overburdening our hospitals. If a safety net like that could be put in place temporarily (I know, I can hear all those go-getting, Just-Do-It, everyman-for-himself Americans shouting me down) because these are extraordinary times, not because people are lazy and want to be paid to be stuck at home. If it could be done until an antibody test is widely available THEN...THEN you can start to get businesses up and running again, staffed with people who've had the virus and have come out the other side. Don't put people needlessly at risk in the meantime because they starve, or can't afford their medications, or they commit suicide from the stress and worry of wondering how they'll live on thin air. Your country has more than enough wealth to go around. It would be immoral not to share resources now. This is not the time for tough love.",Reader Picks,Scotland
"I am a pulmonary and critical care physician in Minneapolis. The problem with the approach mentioned is that, inevitably, there are overlapped rates of people becoming carriers as they are exposed to family, friends, or coworkers in the ""vertical"" approach. As that occurs, they will inevitably spread it to those who are vulnerable, who cannot remain completely isolated (they need caregivers, health provider, people to deliver them food, etc). Under the vertical approach, spread will more likely occur to the entire population. And yes, that would allow for economic activity to continue, but would also lead to nearly everyone being exposed. That would eventually cause ""herd immunity"" prior to a vaccine being developed. Do you realized what that ""herd immunity"" means? It means that everyone is exposed and recovers...and 3 million people (1% of the population) die. Herd immunity works when you have a harmless vaccine...but you do not want herd immunity through exposing everyone to an active virus with 1% mortality and 20% severe illness! Likely more than 1% would die because the healthcare system would be overwhelmed and collapse. Until we have an effective vaccine, allowing everyone except ""the vulnerable"" to be exposed is a terrible idea.",Reader Picks,Minneapolis
"As usual Tom,you are trying to have it both ways.If we did this..if we did that.We haven't done this or that.Everyone agrees there needs to be more testing.Our healthcare industry,in this country,has not given us this ability.Privatization of necessary government functions has been a dismal failure.Healthcare for profit may have worked in the past but in the future it will lead to even greater disasters.This country should not only be about profits and dividends, it should also be about business leaders feeling an obligation to protect their citizens..their employees...without trying to make money off of it. I suggest you continue your reading. Also in the NYT opinion section this morning is and piece by Romer and Garber(economists).Something in the article caught my eye. They say that ""(firms) are reluctant to buy machinery that would be idle when the shortage is eliminated and the pandemic subsides.""Well guess what....there will be other pandemics;there will be other health crises brought on by climate change and.. gross income inequality will greatly exacerbate these problems. I have a wealthy friend who thinks she can just move to Switzerland for awhile. I know you're probably worried about your investments ,and I mine, but...taking the moral and responsible high road is more important.. if my grandchildren are to have a future.",Reader Picks,CA
"Trump has now embraced this idea and will prioritize the economy and his election over public health and lives at risk. If the Times editorial staff has any sense of public responsibility, they will repudiate this column and Brett Stephens's and delete them from the site immediately;",Reader Picks,Cincinnati
"Although I certainly don't begrudge the Times their publishing of the ""contrarian view"", I'd really like to see them publish a rebuttal of this view from one of the vast majority of public health experts who emphatically do not share it. The vertical model proponents tend to criticize emotion driven thinking, but they are no less guilty of it; only they peddle false hope in the place of fear. Secondly, the contrarians need to be crystal clear about what it is they are really proposing, which is to let this thing just wash over the population at large with the exception of high risk groups. Leaving aside the logistical feasibility of pulling this off, NYC is reporting a significant rate of infection among people under 50, including severe cases requiring hospitalization. Finally, though this may be glibly dismissed as ""groupthink"" why do you suppose the government of no developed country, advised by their best and brightest, is proposing a vertical model? Such talk was very au courant in the UK until just last week-- when a visibly chastened Boris Johnson abruptly changed his tune. Why do you suppose that might be? The economic carnage will continue for as long as there is justified fear among the population, which there will be until the virus is contained. Only drastic measures have been shown to contain it--eventually. We are in for a rough time no matter what and there's just no sugar-coating it.",Reader Picks,VT
"In my opinion as a physician, a more targeted approach to containing ""hot spots"" would have worked during February 2020, but only if the government had adequately prepared for mass testing and other effective responses such as those implemented in South Korea. Because we are not yet testing large numbers of Americans, and don't yet know how widespread the virus is throughout society, the only current option for containment is widespread government mandated social distancing. Unfortunately, we are in a position of ""chasing"" solutions rather than rationally dictating the terms of our responses. Reacting vs responding. Not a good position to be in as a healthcare provider.",Reader Picks,NM
"How is 1% fatality rate not HUGE? Infectious at it is, most of the world will be infected. The world's family tree would be seriously pruned--and it's not just older people. Nobody would come out unaffected. Not to mention, many that survive are in for an extremely difficult experience. The feeling of gasping for air, consciousness near fading. No. Thank. You. Joblessness be damned. You can't trade life for money.",Reader Picks,Utah
"I'm a relatively healthy 72 and I have no wish to step aside. I have wisdom and skills from all those years that are still useful in volunteer settings and I still enjoy life. With a little cooperation and planning, no one should have to step aside due to age. Older people are not worth less than younger people.",Reader Picks,SC 
"Our response is reminiscent of how we fought the war in Vietnam. It is not wise, nor is it leadership, to elevate a single measure of success to the neglect of all other factors. Our medical experts have a single, tactical concern--reduce deaths due to CV. Our policy makers must have a broader, more strategic vision that weighs costs and benefits in the balance. Thus far, our response to the CV reminds me of our approach to the war in Vietnam. We have zeroed in on a single aspect of the problem, (direct deaths from CV), and implemented a means of gauging success (body count), that fails to consider a variety of of critical social, economic and political factors (all of which may leave their own medical issues in their wake). Does ""fewer CV deaths"" automatically equal victory, or are there other elements of the problem to account for? An overly facile measure of success in the VN war produced failure at the strategic level. We won the tactical body count contest every time, but the overall strategy was a failure. Is there not some other way to marshal resources (I favor aggressive government action) and fight CV that is more nuanced and will not create the huge social and economic toll that the current approach will?",Reader Picks,FL
It's a valid idea Tom. But what about the masks and other protective gear that will be needed for all that testing and sequestration of the vulnerable population? We could have started to ramp up production of N95 masks and ventilators months ago while Dear Leader was insisting everything was under control. How does your plan get adequate quantities of ventilators and protective gear to the medical professionals who will carry it out?,Reader Picks,Wisconsin
Testing is crucial but there's a time frame. If you wait until everyone is infected how will it help? Seems to be close to where we are in many cities.,Reader Picks,
"Interesting that both Tom Friedman and Brett Stephens cite research done by John Ioannidis, a so called ""meta researcher. "" Meta research combines many studies to supposedly come to a more refined conclusion than run of the mill research. However, the governors who have shut down their states have used research from many different epidemiologists who have studied the response in other countries to recommend social distancing. I wonder if Tom Friedman and Brett Stephens have a political motive for questioning the steps that the governors of California, Illinois, and New York have taken.",Reader Picks,CA
I am glad that the Times has covered the plight of grocery store and delivery workers in response to this epidemic.,Reader Picks,CA
"I completely agree with Dr Horn?s comments and would add one additional thought. Mechanical ventilation is most safely and effectively used when the patient has an endotracheal tube in place. That is a plastic tube running from the mouth directly to the windpipe or trachea. The correct and timely placement of tube is not a simple procedure. It requires learned skills. In my over 35 years of anesthesiology practice, I have placed an estimated 20,000 endotracheal tubes. Now is the time to enlist anesthesiologists now retired like myself to assist with this live saving skill.",Reader Picks,MO
"I think you're misreading the article. Obviously the approach Friedman and Katz are talking about could not be implemented while the number of infections is soaring. I read this article as asking ""What do we do next AFTER we have 'flattened the curve'?"" I'd say the point of the article is that we can't just shut everything down until everyone is well, or until a vaccine is ready. We're like someone who has walked into a cloud of toxic fumes and is protecting himself by holding a plastic bag over his head. That solution is only going to work for a time.",Reader Picks,VA
"I completely agree with all of your points. A 12-year- old girl is fighting for her life in the Atlanta area as we write. She has no history of underlying conditions or known exposure to someone with the virus. Young adults are ending up in the ICU in much larger numbers than expected. When the people at the frontlines, our brave medical personnel, are asked what actions we should be taking, their answer is uniformly, ""Please, stay home.""",Reader Picks,VA
If I was 25 I would chose to work at a hotel or a hairdresser rather than be unemployed for an extended period of time. If you can afford it self isolate: if you are at risk the government should help you self isolate,Reader Picks,NY
"Would someone in the press please, please clarify for everyone that none of the cruise lines Trump wants to ""help out"" are American companies, and therefore in no way deserve any kind of help from US taxpayers via our Treasury ? These cruise companies (nothing essential about them) fly flags of nearly every scofflaw country BUT ours in order to avoid US taxes and labor laws. Does Trump know anything at all? Or is he hoping we and congress just won't notice?",Reader Picks,Maine
"Until we have protective gear and 330 millions test kits, this is an irresponsible approach. We also need to know why a 14 year old boy died and why many 24-55 years require hospitalization. We need physical distancing until our country is ready to move to quarantining only our vulnerable population. That can be sooner than before we come up with a vaccine, but we need to be ready for the pandemic to go wild. Our leadership has let us down. And to think we spend over a Trillion dollars a year on defense (all inclusive of ongoing war and veterans' benefits) and we weren't ready for what should be an easy to defeat enemy.",Reader Picks,Iowa
"Katz?s. I read it. So, at 65 I am just collateral damage so the economy can be saved. So, a bunch of us die for the economy? Do you think we will get post mortem war decorations or will it be business as usual? Not that I will care either way about it after death. Just do make an autopsy so my siblings will have a hint about Alzheimer's.",Reader Picks,FL
"Absolutely. But understand that testing means flooding the zone with tests and some people might need a daily test for a while. If we had the test kits this wouldn't be a big deal. I am tired of winning, Donald.",Reader Picks,MA
"Shockingly naive piece! This was the UK strategy for a few days, until scientists explained reality to the leaders. This disease has a 15 - 20% hospitalization rate. The low death rate of 1% or less depends entirely on beds being available for that many and ventilators for half those hospitalized. Your 2-week-isolation-and-then-go-out-normally scenario will not flatten the curve enough. Take the number of ventilators and multiply by 10. That's the number of cases you can afford to have at any one time. Yes, we need an exit strategy. It depends on expanding supply of testing, gowns, gloves, masks, beds and ventilators.",Reader Picks,MA
"Death rates are low in those countries because the medical systems are not overwhelmed. Fatality rates are much higher when the medcial system is swamped (and fatality rates for many other things--heart attacks, car accidents, etc--increase as well)",Reader Picks,OR
I'm glad to hear you where fortunate to have a mild case of coronavirus. However I think the media has been very clear that the majority of people- around 80% - will have mild symptoms. The 'fear mongering' as you call it is based on epidemiological models that show that more than a million Americans could die this year from coronavirus without strong action. The fact that some experience very mild or no symptoms at all is exactly the problem with this virus: These so called asymptomatic cases are one of the main reasons it is spreading so quickly. It's not just the old. In the U.S. 40% of those hospitalized are between 20 and 54. I assume you are in self-quarantine to protect the health of others in your community. When you are virus free you will presumably be immune so perhaps you could somehow help if your local hospital is indeed overrun as the models predict.,Reader Picks,CA
"Governor Cuomo got it right. Flatten the curve of new hospitalized infections until it stands at zero. It will take some doing. It took China how long? It will also take us as long a time to do. The virus eats people. Somebody will always carry it with them asymptomatically, to a new place, to a new victim; until it?s finally starved out. It?s a air-travelers? disease. It won?t willingly go away. Statistically, time is not on its side. Think of it as a form of inter-species warfare. President D. J. Trump?s utter medical indifference and ignorance, reinforced by Fox presenters? own, played right into its hand. He can, and might very well have, lose the war in an afternoon, as was once said about Adm. Jellicoe and Beatty. So, ?we must all hang together or we will all hang separately?, as Ben Franklin once told his fellow delegates at the birth of the American Nation. We can destroy each other, ignore each other, or save each other. There is no neutral ground.",Reader Picks,IL 
"This Friedman op-ed and some of the comments I have both read online and heard from people in ""real life"" make me feel despair. This callous lack of empathy, against a backdrop of many other factors, makes we wonder if we truly aren't beginning to live in some kind of virtual, ""psycho/sociopathic dystopia"" in which any kind of compassion, deeper level of understanding or empathy to our fellow human beings is being significantly reduced. Perhaps it's the effect of seeing everything on a screen and not being able to relate it to our own lives, our own lives, that is, until it becomes very real for us and by which time it may be too late. It also worries me, being old enough to remember the HIV/AIDS scare in the mid-1980s and recalling the callous attitude many, including some who should have perhaps known better, had towards certain sections of society who were considered the most vulnerable. Roll on thirty-odd years and with Covid-19, we're hearing, perhaps, a similar kind of callousness and lack of empathy. Will we ever live and learn? Human lives are not mere statistics on a spreadsheet.",Reader Picks,Berlin
"Sadly this has long been the ?American way.? Without mandated restrictions, most Americans will not inherently ?do what?s best for others? in lieu of what?s best for them. American history has shown that the collective does not tend look out for the few. A simple, and rash back to business strategy might back break us all. You cannot discount experience and sadly our federal government is lacking in experience. There was a severe shortcoming in preparation for this epidemic and now we must all pay the piper.",Reader Picks,CA
I guess I am 68 and live in a multi generational house. I disagree. My mother lived through the depression. I took care of her till her death at 98. The younger generation could stand to learn a bit about self-sacrifice. The economy will rebound.,Reader Picks,Texas
