comment ,pick,state
"My friend is a nurse in Las Vegas. She told me today, that the hospital at which she works does not provide the nursing staff N95 masks, only surgical masks and gowns, and that the workers who clean the rooms of the covid19 patients are not properly protected. If we live in a country where the medical workers themselves cannot obtain adequate protection, I don?t know in what sense we can be called an advanced nation. I don?t know the right thing to do. I have felt the panic has been overblown, then have felt I was way wrong on that. Now I don?t know. I hope there is a way to help the economy. Many many poor people will be destroyed and their families will literally starve to death if we cannot get something going again. And they will not have had covid19. This I know: no work and no income will destroy the world faster than covid19.",Reader Picks,NY
"The reason to shut down is to prevent the healthcare system from being overwhelmed. If it is overwhelmed, there won?t be enough beds or ventilators to perform life saving surgeries for cancer patients, perform open heart surgery for heart attack patients etc and so not only will 1 million deaths occur from Coronavirus but millions more will occur from all the other diseases that we can?t treat because there won?t be any capacity to do so. However, if this shutdown goes on for a year, many will lose their jobs and many will die from not being able to pay for healthcare and choosing against getting treated at all. So, to optimize our situation, to find the best possible option among all bad options, we need to find a way to get people back into the economy while minimizing the spread of the virus. To do that, we will need to get our infection control doctors who understand viral transmission to group hack with restaurant owners and hoteliers and airline people to figure out a way for people to gather together safely. What if everybody just wore fresh robes and masks to the movie theater? Then put them in a hamper to be laundered before and after? same with airlines? The virus is spread by contacting high touch surfaces and the touching ones eyes or mouth or nose....so let?s figure out a way to block that! Let us consider setting up restaurants with barriers between tables, rules for all servers to wear masks all the time etc etc. allow people into museums with a mask etc.",Reader Picks,VA
"No, many people cannot. Many of us have constant close contact with customers. We are breathing the same air as our customers. No amount of the Purell that can?t be bought anymore anyway will help that.",Reader Picks,Missouri
"Perhaps we can manage a complete economic overhaul where sick workers can stay home, grandparents are not nannies, seasoned teachers can retire to a younger, fairly paid faculty. Until then, there can be no meaningful protective ?divide by age? policy.",Reader Picks,USA
"We also need serological testing to show which people now have the coronavirus antibody, and I would recommend that once a person is serologically tested confirmed to have the coronavirus immunity that they be given a ""Coronavirus Passport"" that would identify them as such. We could then expose those people in jobs to the population of yet infected but vulnerable. For example, imagine a nursing home where all of the staff have already had the virus and are fully recovered, and pose no threat to their patients. Additionally, as tens of millions of people get infected and fully recover we need allow these people to reopen the economy and to be able to get on with their lives, and that means reopening all of the businesses long before we all had the ""chance"" to go through that process.",Reader Picks,MA
"Great idea-once we have the test kits and supplies necessary for this. But since our government had shown little urgency in getting that done, we need to be shut down until it does.",Reader Picks,Missouri
"Here is a quick back-of-the-envelope calculation. If the US population is 327 million people and it cost $1,000 per Covid-19 test, that would be $327 billion dollars. And the pandemic would be able to be squelched in a matter of several weeks because we would know exactly who is infected and isolate them or treat them until the disease ran its course. The economy would go forward; the uninfected could go on with their lives. And $320 billion is much less that the rescue bills that Congress is proposing which may exceed $1 trillion. Yet, of course, it doesn?t cost $1,000 per test, and we wouldn?t have to test anything like every man, woman, and child. South Korea, whose example is wonderfully relevant as they had their first episode on the same days as ours, January 19th, is way ahead of us on testing and public health spending. And their Covid-19 case numbers are receding already. They had learned from the pandemics of SARS (2003) and MERS (2015) while we were seemingly unlearning those lessons. Covid-19 should be a lesson for the importance of public health measures for our future",Reader Picks,IL 
"You are assuming that we have leadership in this country from the federal government. We do not. This administration could not do targeted testing. And pretty glib to be throwing high-risk groups to the wolves. There was a story in this paper stating that 38 percent of the people in hospitals in this country with coronavirus are in the 20 to 54 age group. The elderly and immune-compromised are not by any means the only ones who are succumbing to this virus. Agreed that it is good to keep looking at what our best solutions could be from many viewpoints. But what are you seeing that makes you think this government could accomplish anything so deft as a targeted approach? Trump and the Republicans won't help Americans if it endangers their wealth and power. I don't think that you would write such an opinion as this if you or someone in your own family were ill, Mr. Friedman.",Reader Picks,NY
"Correct, we would need episodic testing so that the infection to detection interval is less that the infection to transmission interval. You want to cut the effective R0 from 2.3 without testing, to something less than 1.0 by reducing the number of days infected people are walking around. It takes some time for viral load to build up to maximum transmissibility and I believe you can get a test detection before you are infectious, but even if not stopping infected people from interacting for two weeks - or longer - will slash the transmission rate. Imagine ?hall passes? tied to your driver license that gives you access to broader society. The hall pass needs to be renewed every N days. If there are more infections detected, N goes down, more cases per population, N goes up.",Reader Picks,CA
"Oh thank heavens for this emerging voice of reason at the Times -- seemingly the only one here amidst the exhortations to hysteria. I had started to migrate over to wsj.com, frankly, because they seemed more willing to question the shut-off-the-economy-indefinitely strategy which while well-intentioned cannot be the answer -- and not only for the reasons Tom says in this column, but also because at around week four or so, more and more people will simply start to ignore our governors' orders, and the ensuing confrontation between citizens and law enforcement and consequent loss of goodwill and trust in government could be profound. The public can last four weeks -- maybe a bit more -- if the public is told now that's that what it will take. But ""stay at home"" until further notice is going to drive people nuts. (Can you imagine a 95-degree July afternoon in NYC, when half the population has no air conditioning?) We really do need to pivot to ""vertical interdiction"" before we enter the long term.",Reader Picks,PA
"Yes, indeed. We seem to prefer another Russian usually referred to as oligarchy. The politically connected steal the natural resources of the country- excuse me privatize the public lands, etc... When will the Press publish the real truth and stop bashing poor old Bernie. Tax breaks (by states-/cities and then the corporations don't do what they said they would do -- Foxcomm.. Amazon. etc. - ill conceived, special deals for chosen corporations.. I wonde who has th subway cleaning contracts-- some clean and some don/t,)",Reader Picks,
"TEST EVERYONE A.S.A.P. period. full stop. Without that, we do not know the dimension of this epidemic in the US. We don't even know whether a majority of Americans already would test positive but are asymptomatic. Right now, we are led by the blind and we too are blind because we are lacking the facts.",Reader Picks,CT 
we are not at all doing the things advocated for in this article - far from it. Business are closing and sliding towards bankrupcy. People are told to stay indoors.,Reader Picks,NY
"Has anyone shows that flatten the curve can even work? It's a strategy that results in everyone eventually getting the virus, but at a slow enough rate that hospitals can handle it. What rate is that - the maximum acute hospitalization rate at any given time? The U.S. has 534,964 staffed (operational) acute care beds, including 96,596 ICU beds. First, let's just assume we can magically double that capacity to about 1 million. Or 1 acute care bed for every 300 people. Second, let's assume the coronavirus infects only 25% of Americans and only results in acute hospitalizations in 10% of those cases. These are optimistic numbers (very well could be 70%/20%) but that's still 7.5 million cases. So how many months do we have to flatten the curve for our magic 1 million beds to cover 7.5 million cases spread over time. Well, looks like 7.5 months. Unfortunately by then every small business in American will be bankrupt. Every dentist. Every restaurant. Every real estate agency. Oh and Tesla, Boeing and Bank of America too. 7.5 months doesn't work. 3 months doesn't even work. We either lock down for 1 month or we need to take Friedman's advice, isolate the elderly and restart the country in 4 weeks.",Reader Picks,NY
I agree. We are expats in Singapore. This is basically what has happened here.,Reader Picks,MA
"This article nicely summarizes what I have been thinking since the shelter-in-place orders started coming out. Shutting down the economy seems to be an extreme over-reaction to a virus that we are only now learning about. The vertical approach makes infinitely more sense. I hope our political leadership is considering this. If they continue with total suppression, they will make this a much larger problem than it already is. Panic and hysteria have take over. Logic and reason need to reassert themselves.",Reader Picks,CA
"Ignore the virus and carry on and ""take the hit""? Look at Italy. Spain, and Iran. America is now on a similar trajectory. Why? Because we have no aggressive proactive plan to screen the public and isolate sick individuals. Rather than fighting community spread of the virus, all we have managed to do is to scramble to have the means to care for the sick. And over one month in, even that has yet to be actually delivered. So sure, if the federal government continues to take a passive approach, people will be forced to return to work at risk of contracting and accelerating the spread of the virus. The only way we are going to return to a semblance of normality is to take steps that reduce transmission of the virus and make it relatively safe to go out on the streets and return to work. We are not going to wish the virus away.",Reader Picks,MD
"Dr. Mark Lipsitch of the Harvard School of Public Health and his colleagues have used the actual data (as opposed to personal philosophies of government and economics) to project, credibly, that the suggestions outlined by Mr. Friedman would likely overwhelm the ICU capacity of the U.S. within a few weeks. http://nrs.harvard.edu/urn-3:HUL.InstRepos:42599304 These projections are supported by the work of Dr. Neil Ferguson and his group at Imperial College London, who project that a ""protect the most vulnerable but get back to work"" approach would overwhelm, several times over, the ICU capacity in the UK and the US. If Mr. Friedman has actual data to suggest otherwise, he should publish it.",Reader Picks,PA
Our current approach is an overreaction based on panic and is unsustainable. In about a month supermarket shelves will be empty and supply chains broken. By next fall the world will be in a depression and the US will be bankrupt. A targeted approach makes much more sense and will work. It has already in Singapore and South Korea.,Reader Picks,MA
"How is Governor Cuomo claiming 40-80 of NYC residents will get Covid? That's 4-8 million people! Wuhan, with a similar population and density, has had a total of 80,000 cases so far. The Chinese admittedly took draconian measures but if New York takes one-third of those draconian measures wouldn't that result in 240,000 cases? Or is Cuomo saying the city is so ill-prepared, its residents so non-compliant, and the federal government so non-responsive that 4-8 million is a real number? Even northern Italy, the poster child for ill-preparedness with a population of around 20 million, has 60,000 cases so far. Somebody help me out!",Reader Picks,Connecticut
"I have been advocating Dr. Katz?s solution for a few weeks now, with one additional and critical requirement: base our decisions on a credible epidemiological model, based on good experimental design, rather than loose speculation. Currently, we are guessing how many people have the virus, who gets how sick from the virus, and how it spreads, because we are only testing those who are seriously ill. We need controlled experiments to develop better models of contagion, morbidity, and mortality. Specifically, take a few ?populations,? e.g., a factory, office building, or university, test every single person and their families to determine infection and disease patterns, and build credible models to more accurately predict rates of infection, hospitalization, and death.",Reader Picks,IL 
"Yea! What Friedman is saying is what I and a few others have been pushing for in variations on selected internet comment boards and forums. Unfortunately, we too often get ganged up on by the fearful, hysterical, panicked population that ranges from the uneducated to medical professionals whose fear has been flamed by the 24x7 media. A few days ago I heard former US Surgeon General Vivek H. Murthy, acting as a medical consultant on MSNBC, predict that deaths in the USA could range from 2-3 million people! Say what? It's not unreasonable for regular people to hear statements like this from medical professionals and become scared! Trumps's Dr. Fauci is in the same boat, fanning the flames of fear about the worst case possibilities of the virus. Dr. Fauci also does not care about killing the economy to battle a virus that might ultimately be no worse than a strong flu. There is so much scaremongering that people have become convinced that if you get this virus, you will most likely wind up in the ICU and will have a good chance of dying, which is far from the truth! Most recover w/o problems. We need to follow Friedman's course of action, get everyone back to work and restart the economy ASAP. With every recession that we wind up in, there always seems to be some number of people hopefully talking up a ""V"" recovery. That is not going to happen in this case. The recovery is going to be slow and will take some time. The sooner we get started, the better for all!",Reader Picks,CA
"I think this is a gutsy article proposing a gutsy idea. If the ship of the Coronavirus has already sailed, as some experts suggest, then the rational strategy is a targeted, vertical isolation, after we go through the first initial weeks of general isolation. The shutting down of the economy for an unknown period of months, may bring a calamity worse than the Coronavirus. Widespread testing is needed for a targeted approach though.",Reader Picks,CA
"I think this is a gutsy article proposing a gutsy idea. If the ship of the Coronavirus has already sailed, as some experts suggest, then the rational strategy is a targeted, vertical isolation, after we go through the first initial weeks of general isolation. The shutting down of the economy for an unknown period of months, may bring a calamity worse than the Coronavirus. Widespread testing is needed for a targeted approach though.",Reader Picks,NJ
"We can wring our hands all we want to about which direction is least bad, but the fact is: shelter-in-place / ""stay home"" directives won't work, anyway. All of this conjecture assumes that millions of people will accept *certain* destitution. Today's model citizen who is shutting themselves inside, insisting that there is no other way, won't feel the same way when they can't pay the electric bill or can't work because there's no childcare. Or when they don't have a job at all. So, if we're going to have a ""plan"" at all, let's make sure it's realistic. Prolonged complete shutdowns are not realistic, period. I think this article is paying mind to that fact, and we shouldn't shun these other options just because we don't feel good about it.",Reader Picks,OR
"USE THE THERMOMETER! This provides frequent, real-time testing. PCR-based detection is great for conclusive diagnosis, but if we are to get the population back to work, we must be monitoring our temperatures multiple times a day. And some level of temperature monitoring to enter public buildings (schools, churches, banks, and especially our work places) will mitigate cheating. I know the naysayers will say you can spread virus without having a fever...nonsense! If you have covid-19, you will have a fever. But it is often quite mild (<38C/100F) so putting a hand to your forehead will not suffice. Buy a good thermometer and start taking your temperature 3 times a day. Protect yourself and your loved ones, and the rest of us too. We need to get the world back to work.",Reader Picks,NC
"The WHO suggested rate is 3.4 percent. There are two ways to calculate fatality rate from the data published at https://www.worldometers.info/coronavirus/ One is an upper estimate based on all of the active cases becoming a fatality, The lower estimate assumes all active cases result in survival. China high-low fatality rate 4.30% 4.03% Italy high-low fatality rate 43.81% 9.26% USA high-low fatality rate 71.75% 1.30% Germany h-l fatality rate 26.11% 0.38% China and S Korea have both shown you can break the back of Coronavirus in 3 or 4 weeks with aggressive social distancing. Now their new case rates are too low to be a threat to anyone. at 39 for China and 64 for S. Korea posted today, basically flat. US new cases are still increasing rapidly. High risk people (my daughter is one) should and will self-quarantine (if their workplace permits it)",Reader Picks,CA
"During the Spanish Flu New York City made a decision not to close the schools. Instead they assigned health workers to the schools and sent home any students that were sick. When it was over New York did far better than either Boston or Philadelphia. Today we need the same approach with all workers being checked for temperature ( and perhaps ability st smell odors). as they arrive for work. Those that test sick are sent home, healthy ones allowed to work. For more tips on how to deal with this virus we should be following the example of Taiwan. My thoughts.",Reader Picks,
"Every time I hear a leader claim that this virus could infect 40-80% of all people, I wonder what empirical evidence they are drawing upon. They never say. This is a serious catastrophe at the current level of a 1.4% case fatality rate. Escalating it to incomprehensible tragedy appears to be a political strategy, not a scientific one.",Reader Picks,MA
"Let the government that denied and bungled this threat find concrete, immediate, substantive and effective ways to compensate those who are most economically damaged and least able to withstand the disparate impact of the business shutdowns.",Reader Picks,NJ
"Here is a high-level idea to get society back to normalcy. With the approval of Cepheid?s rapid test and the potential for drug treatment of COVID-19, I think there is an opportunity to get herd immunity without overwhelming the healthcare system or sustaining unacceptable mortality rates. Outline: Set up large numbers of while-you-wait testing site, coupled with mobile units for hard to reach populations, where people with symptoms can get tested. Once the clinics are set up, slowly allow the population to get back to normal activities (the rate of restriction abatement would need to be modeled carefully so as not to overwhelm the system) When someone tests positive at the while-you-wait clinic, provide them with a first line treatment (e.g. hydroxycloroquine + azithromycin) and home isolation for 14 days. The non-responders would be admitted to the hospital and given more potent antivirals (remdesivir IV) and/or IL-1/IL-6 inhibitors. Clearly, treatment efficacy and testing/drug availability must be high for this to work but I think we have a path to get herd immunity and not wait for a vaccine.",Reader Picks,CA
"Thomas Friedman, do you even read the newspaper that you publish your stories in? Young people are making up 40% of those who are taking up hospital beds in NYC. There are 8 million people living in New York. The idea that only those at risk should be staying home is dangerous and insane. There aren't enough ventilators. And medical staff are being asked to make their own masks (not medical grade) and come out of retirement to help. If you want to save the economy-- then stop this virus in its tracks. Hit the pause button. Bail out those at those who have lost their livelihoods -- who can least afford to be without a paycheck. This is an emergency. A high percentage of people will die if we do not get respirators to the hospitals who need them.",Reader Picks,NY
"This cannot continue for much longer. We are learning more about the virus every day; how it spreads, who is at most risk, and how to contain it and protect those that are most vulnerable. And this isn't going to be the last time we face an issue like this. The chorus of ""if we can save one life it's worth it"" is starting to be heard louder and louder. My dad is 74-years old, suffers from COPD and diabetes. We don't need the entire economy to shut down to protect him. We don't need every child in America to be out of school. We don't need millions of layoffs of the most vulnerable wage earners. If you are at risk - stay at home. If you are sick - please stay home. Wash your hands, use common sense. And yes, people are going to get sick and some are going to die -this is what viruses do. It is amazing to me what amounts of our freedoms we are willing to give up for even the smallest, nonsensical sense of security.",Reader Picks,NJ
"Tom,you are ignoring the one overwhelming stress that kills people daily--no heath insurance. This is the first country without universal healthcare that the virus has hit. TENS OF MILLIONS of people in this country live with the stress of no health insurance and therefore no possibility of seeking medical care. Breast cancer survival rates have been unequivocally tied to health insurance availability. Most of the biggeat employers in this country deliberately employ strategies to keep employees on a co tract or part-time basis specifically so they will not have to provide health insurance. So while you worry about economic stresses shortening lives, don't ignore the one situation that's killing Americans on a daily basis and will continue to do so after this crisis is over.",Reader Picks,VA
"I feel disheartened that you would write this article when you lack public health expertise and failed to fully represent their perspective. I greatly fear the impact of America's economy crashing and the global implications this will have for our world's most vulnerable populations. However, I also fear the impact these types of articles are having as we take first steps toward mitigating this crisis. While our nation's experts are dealing with a new virus, they have the more tools than you to determine the harm it can cause. I would love to take a ""surgical approach"", but as many have said already, our parameters are different than Singapore's or South Korea's. In the future, I don't think you should sum up the perspective held by our nation's experts in epidemiology and infectious diseases as ""groupthink.""",Reader Picks,NC
"You want the United States to analyze all young people and determine which ones have hidden underlying conditions, in two weeks? Test all health care professionals in two weeks? This is a great wish list but the time for surgical precision was probably 5 years ago. We weren?t ready for this. Singapore, Hong Kong, South Korea were.",Reader Picks,CA
"Shutting down the global economy makes no sense. People die in car accidents every day. Do we ban cars to protect people? No, we build safety features into cars, we maintain roads, we encourage good driving behaviors. Do I want to get sick? No I do not. But let?s stop panicking and protect the most vulnerable so the rest of us can contribute to the economy.",Reader Picks,Florida
