comment ,pick,state
"Doesn't the targeted approach require massive testing? Yes, it does. And we're not there yet. Until we are this advice seems premature.",NYT Picks,Utah
"I?m at a loss. I made it through 9/11, Super Storm Sandy and the Great Recession. Under Obama, I recovered. Trump?s tax laws brought my profession down again. Working 3 jobs now, an employer who promised to stick with us, sent this today on Sunday afternoon. ?I hope that you and your family are staying healthy and safe during this unprecedented time. Given the current circumstances due to COVID-19, I?m going to have to suspend all my business activities indefinitely, including all employment. I sincerely hope, as I?m sure everyone does, that this terrible situation is over quickly and we can resume our work.? If you?re a business owner, have enough compassion to make a phone call....on a Monday.",NYT Picks,NY
"I'm 76 years old. How incredibly selfish it would be to wish for a nationwide shut down for the next 6 months to increase my chances of living. My life, at this age, means nothing compared with the tragic economic suffering of millions of my fellow Americans.",NYT Picks,NC
"I have zero faith that anyone even remotely attached to the Trump administration has even the faintest idea of what to do. We're well past the initial, highly important, testing phase that could have lessened the impact of this crisis because of Trump's ineptitude and ignorance. This health threat isn't going away in two weeks and it's just wishful thinking that we as a country will be back on track anytime soon. Closing down the economy for a month, sheltering in place for a month, and testing huge swaths of the urban population is not overreaction, it just makes sense. In the best case scenario only thousands will die, in the worst case hundreds of thousands, perhaps more, will die. The cost to the economy is whatever it will take to beat this.",NYT Picks,SC 
"The Katz/ vertical plan has a serious flaw: Many American households are multi-generational (especially lower income ones and minorities) with seniors living under the same roof, or have family members with underlying medical issus that make them vulnerable. What happens after two weeks when mom and dad, along with the kids, are symptom free and return to work and school but grandmother or a family member on chemotherapy still are at home? What happens to this populartion?",NYT Picks,Utah
"No need to alter the approach except to protect known at risk individuals. Americans are incapable of following a directive, especially if it is mostly to benefit someone else. The bulk of the American people have voted selfishly for 40 years and they will act selfishly now. The best you can do is lockdown and then let what happens happen. It will pass fairly fast because Americans will continue to spread it fast. It will also kill a lot of people, but that is the American way, rugged and careless individuals that they are. Just kidding about the rugged part. No way you don't have 6-18 months of dire case loads and economic issues. The economy is not coming back anyway, because it was always fake and built on baby-brained consumers.",NYT Picks,PA
"The best hope for rescuing our economy is through testing. Yes, we need to be manufacturing masks and ventilators, mobilizing health care teams toward a surge in intensive care needs and preparing new beds in make-shift hospitals, but even more importantly we should have all hands on deck to ramp up our ability to test - now. When we can test almost anyone for active infection, and then when we can test health care workers and others at risk for immunity (much later, if ever), then we can start to isolate intelligently. Only then can we move away from the blind indiscriminate quarantine we have now. Later, when we identify some antivirals, or other meds that might rescue the infected from the most severe illness, and then even later when we have a vaccine, life will return to normal. But the best way to move society back to a more normal economic footing is to test, test, test.",NYT Picks,CA
"This is brilliant and important, but also obvious, and it?s shocking to see so-called leaders taking such a blunt and overkill approach currently, with no clear plan, which will do so much more harm to society than the virus over time. True leaders make difficult and sometimes unpopular decisions for the overall good, which of course is challenging in this environment, but is rarely more important than it is now ? to accept that some people will (unavoidably and unfortunately) die but those with a high chance of survival should be able to return to work after two weeks and support the system and others (assuming that proper testing and tracking are available) for the long term benefit of society. It?s frustrating that this debate hasn?t received more attention but I agree it is desperately and urgently needed.",NYT Picks,NY
"Once this virus is contained, let us pressure our elected officials to pass a Green New Deal. That would put a lot of people back to work in good-paying jobs and address this climate crisis: installing solar panel, wind turbines and green roofs, insulating buildings, expanding mass transit, building bike trails, planting trees and growing food with restorative agriculture. Let this coronavirus crisis awaken more to that other great existential threat called climate change, which if unaddressed with the urgency it requires will devastate us even more.",NYT Picks,US
"A society that cared about all of its members equally would ensure that those who are forced to stay home and lose their incomes/jobs are compensated for their bearing the brunt of protecting all of the rest of us. It is a flaw in our dog-eat-dog capitalism model that we are willing to tolerate so much suffering (and such negative health outcomes) for those who lose their jobs. This should be a wakeup call for us as a society: those whose jobs are displaced by superior technology, whether coal miners, auto manufacturers, truck drivers, or data analysts have similarly done us all a service by continuing to do work that needs to be done up until such time as it obsolesces. Unemployment (for whatever reason) should not mean that one's children starve or lack for opportunity.",NYT Picks,NY
"I like the general theme proposed, but like many others, question it's feasibility, given the present shortages of key equipment: testing, ventilators, masks, testing, etc. Which doesn't take away from the validity of the proposal, that it's very worth considering, but that perhaps we must wait another week or two (or more) until it can be put in effect.",NYT Picks,WI 
"As a nation, we have blindly walked into wet cement by insisting upon maintaining a system in which many have no heath insurance, many others are covered only as long as they stay employed, and tens of millions of working Americans live only a few dollars from bankruptcy. Like catching a disease, these disasters come about through little or no fault of the victims; they are the inevitable consequences of the system we have built. It?s a catastrophe of our own making, mainly because we have been indoctrinated into having a greater fear of the mythical dangers of Socialism (falsely sold as a synonym for Communist Stalinism) than of the real life consequences of winner-take-all capitalism. No amount of social planning can completely protect us from catching something virulent, but as it stands we have made one of life?s risks much worse than it needs to be. Once the pandemic passes, and before the next one sweeps the globe, perhaps it is time for the survivors to grow up.",NYT Picks,
"At a time when hospitals are desperate for basic supplies like masks, gowns, and swabs - not to mention ventilators - to treat those who already are seriously ill or dying, your suggestion that we ""let many of us get the coronavirus"" sounds like a prescription for ""dying in place."" Yes, a targeted approach to mitigating the spread of COVID-19 would be desirable in an ideal world. But we do not - at least not now - enjoy that luxury. We might have had better options weeks back, had our leaders not sat on their hands. Instead of calling for swift action, they called their stock brokers. Relaxing the practice of social distance will surely overwhelm an already dismal situation in our health care system.",NYT Picks,Missouri
"Talk about pie in the sky. As stated, the opportunity for a more targeted approach has already passed, thanks largely to the federal government's failure to sound the alarm sooner. The idea that we can quickly figure out why some young people sicken and die from Covid-19 is another nonstarter. It's a new virus and we won't have answers to questions like that for months or more. Having people continue to work in hotels, restaurants, etc. is not going to accomplish anything. People are scared and demand for most things, including hospitality and dining, has collapsed. Workers need customers to service. Without customers, employers can't pay to keep workers on the job. That's economics 101. Meanwhile the virus will spread further while people are at work with no customers (or not enough of them) coming through the door. The only solution, given the failure to respond earlier, is to shut down the country and print money for a couple of months, or even longer if necessary. Not a good solution, but the only one now available. Trying now what might have been workable two months ago is a recipe for disaster.",NYT Picks,VT
"My wife is a nurse in San Francisco- can't even get a straight answer about how many N95 masks are available. Different hospitals have different ideas if its even airborn or not.... How are you going to organize the whole country to ""follow the rules"" and get back to work. When the most vulnerable first responders aren't even being properly protected?",NYT Picks,CA
"Set aside whether you agree or disagree with the plan espoused in this column. We can agree that it is complex and requires leadership and intelligence. Now remember who is president of the US and ask yourself if he and his team are capable of leadership and intelligence. Having read a lot of these ""contrarian"" takes on the crisis over the past week, my conclusion is that the first thing the contrarians such as Friedman need to do is to call for Donald Trump to resign. There's absolutely no possibility of achieving Friedman's ""smart"" virus plan while Trump is in charge. As long as they don't call for his resignation, and as long as he doesn't resign, we're stuck with the state by state shutdown strategy.",NYT Picks,CA
"I appreciate Mr. Friedman's attempt to broaden the conversation but, speaking as a Harvard trained epidemiologist, there are so many problems with what he wrote that I found this more misleading than helpful. Just one (of many) puzzling comments in this editorial: Dr. Steven Woolf, director emeritus of the Center on Society and Health at Virginia Commonwealth University, shared with me some thoughts he was hammering into an essay: ?Society?s response to Covid-19, such as closing businesses and locking down communities, may be necessary to curb community spread but could harm health in other ways, costing lives. Imagine a patient with chest pain or a developing stroke, where speed is essential to save lives, hesitating to call 911 for fear of catching the coronavirus. Or a cancer patient having to delay chemotherapy because the facility is closed. Or a patient with advanced emphysema who dies for lack of a facility with a ventilator.?? How would NOT closing businesses and trying to limit community spread result in seriously ill individuals feeling safer about calling 911? Where is the evidence that chemotherapy is being delayed due to facilities being closed? That's like saying hospitals are part of the mandated business closings. Ah, I don't think so. Individuals with advanced emphysema are MORE likely not to have a ventilator if we don't slow down infections and take the burden off the health care system. Very disappointing article.",Reader Picks,MA
"But, we did not have testing available when it was most needed because the administration decided not to accept testing from WHO. We do not have adequate testing now. 40% or more of infections are in those under 50 and some of these die, so it is not the flu. Herd immunity requires about 70% of the population to have contacted the virus or been immunized with a vaccine. Natural herd immunity has a steep curve that will kill hundreds of thousands. Vaccination is at least 12 months away. Yes, we should have had testing available so we could have isolated those at serious risk of dying (nursing homes, retirement communities, elderly workers , etc) but we did not and now we have vectors all over the US with little or no testing available to determine which of the high risk people are infected or which of the low risk people can go back to work in a non-infected work place. We lost the chance to contain the economic disaster we are now entering because of incompetent, intentional, poor governance from a republican party that has wanted to shrink the government until it could be drowned in a bathtub for the past 40 years. The republican party is now killing the US population instead. We will get through this, but the republican party needs to pay a high price. They need to go the way of the Whigs.",Reader Picks,montana
I make $14/hr. No benefits. Really not hurrying back to that...for the economy's sake or mine.,Reader Picks,IL 
@mitchell Exactly this. Until we have wide spread testing everywhere available to literally everyone we can't just go back to business as usual. We need to test people as frequently as needed to isolate infected asymptomatic cases as soon as possible to decrease the infection rate. Then and only then life can go back. Otherwise this disease will keep coming and hitting in waves.,Reader Picks,IL 
"You are not paying attention. The only way we could have gone back to work quickly would have been massive testing as soon as the corona virus arrived in America. We missed that opportunity. Of course people want to go back to work, but be realistic. Don't you have some responsibility as a columnist to promote a realistic assessment of the facts? Based on what is happening in other countries, we may not be at 'peak corona' until early- to mid-May. If everyone leaves self-isolation without testing, then asymptomatic people who have the virus will give it to others, and the process will start again. This whole mess could have been avoided by massive early testing. But the president said it wasn't serious.",Reader Picks,CO
"This crisis is striking at the frailest part of America: Our identity. For two centuries, we?ve been fed a diet of propaganda that we?ve all frontiersmen and rugged individualists, and nothing can abrogate that. Whatever threatens our ?I?m going my way? ethos is the enemy, from Native Americans to terrorists. We?ll draw our trusty six-shooters, saddle up, and yee-haw our way to victory. Except that the terrorists this time require that we think as a collective, that we drop our cherished pretense as one of 300,000,000 people going our own way, and start going the same way together, or else. We?re not cowboys or frontiersmen. We?re neighbors and coworkers who need to think like a Union, not a loose collection of states. That?s the primary failing of Trump; he?s spinning a romantic trope -me first, I?m an American ? that is counterproductive at least, and deadly at worst. We?re not cowboys, and our individual actions affect everyone else.",Reader Picks,CA
"Not a word here or anywhere about taxing all billionaires out of existence, as we should?ve done long ago, to pay for all this? Humanity can no longer afford billionaires. Put an immediate 90% tax on everything over 1 billion, and if they no longer feel they have incentive, they can go work at a hospital where they might actually do some good. Ownership is productive of nothing on its own. A person making 50 K a year could survive for 20,000 years on just 1 billion. Tough luck if they can?t be comfortable for the rest of their life with just that amount. Shameful that they all aren?t offering to pay for as much as they can right now.",Reader Picks,Wisconsin
Wasn't this an argument made by Boris Johnson for a while - until it was calculated that this approach would lead to 500k deaths?,Reader Picks,Dusseldorf
"This is an imaginary prescription. It accounts for a perfect sequesterstion of vulnerable populations. Dangerously, it confuses the message to the public. Please hold off any solutions for now.",Reader Picks,NY
"No, the cure is not worse than the disease. Dead people cannot spend money. It's that simple. Only a 1% fatality rate? There's no such thing as ""only"" 1% of human beings. 1% of 7.7 billion is 77 million. That's 77 MILLION human lives. Consider the following: 1. COVID-19 is not the flu. It is at least 5 times as deadly, it is more transmissible, it has a higher incubation period, and it randomly kills healthy individuals. 2. Because of the high incubation period, self-isolating after symptoms develop is simply too late. 3. Allowing it to spread will allow more strains of COVID-19 to develop, potentially making it impossible to vaccinate against. 4. If COVID-19 becomes a seasonal illlness like the flu, the mortality will be largely additive ? every year, some people would die from the flu, and others from COVID-19 (or some strain of it). Let's talk about the economic impact of an additional 150,000 annual deaths! 5. Our economy isn't actually grinding to a comple halt. Many people ? Friedman included ? are able to work remotely. 6. Without drastic action, virtually everyone will get this illness. 7. If we can't flatten the curve, our health care system will be overwhelmed and the death toll will be much worse than 1%. 8. It's impossible to fully isolate the most vulnerable because they are cared for by the less vulnerable. Friedman may think some humans can be sacrificied for the good of the economy, but the economy IS human beings, and we're all in this together.",Reader Picks,NY
"It is always questionable to form a strategy based on one or two opinions, even if those are expert opinions. Criticism of Ioannidis from others, including epideiologists, is all over the web and may be for Katz, though I haven?t checked. Science works by concensus, not lone mavericks, in spite of a great deal of fiction that passes for science. The bottom line is that we have missed the testing, testing, testing boat so badly that all we can do now is flail around in a rather haphazard effort to contain.",Reader Picks,Canada
"We are united as an industry and speaking with one voice,? the chief executives of major airlines, UPS and FedEx said in a letter to congressional leaders on Saturday. ?We urge you to swiftly pass a bipartisan bill with worker payroll protections to ensure that we can save the jobs of our 750,000 airline professionals,? wrote the group, which included the heads of Southwest Airlines, Delta Air Lines, United Airlines and American Airlines. If Congress approves at least $29 billion in grants for the industry, the executives said they would commit to no furloughs or layoffs through August. If an equal amount in loans is passed, they would commit to limiting executive compensation and freezing stock buybacks and dividends for the life of the loan."" The above is from another article. What galls me is the airlines WERE PREVIOUSLY BAILED OUT. They were irresponsible and didn't save for a rainy day. They were fiscal TODDLERS. Living in the short term. Now it looks to me that they are attempting to wield their influence in the POLICY REALM. They are unelected. They squandered reserves with executive pay, stock buy backs and shareholder dividends. Now, I don't care if they fail. Let them. Unless, they change to less carbon intensive practices, they are still polluters and we still ultimately pay the price of their greed and recklessness as citizens of a global society.",Reader Picks,NM
"These are the musings of someone with first-rate health insurance and the affluence and social prominence to obtain the best of medical care on top of that. There is simply no practical means to ""sequester"" the most vulnerable, especially with a rapidly moving virus that will doubtless itself be the best determiner of who is and who is not the most vulnerable. That would entail ripping apart families and communities. We don't all live in separate nuclear-family homes, our kids and parents in homes of their own, or age-sorted, gated communities. Even if we did manage to sequester many of the vulnerable, that would still leave the poor bearing the brunt of the consequences of this basically cruel and indifferent herd inoculation scheme. It's not so much a plan as an argument for immediate capitulation to what ""nature"" will do if left alone, in order to save the grotesquely unequal structure of our current economy from any more disruption or the challenge that might arise from too long having to provide support to the general populace that looks an awful lot like Andrew Yang's Universal Basic Income and Bernie Sander's Medicare For All. In short, this is Tom Friedman sinking to a low I previously did not imagine him capable of reaching. Crisis truly brings out the worst in some people as it brings out the best in others.",Reader Picks,CA
"So easy to say when you can bloviate from home. Other people don't want to put themselves at risk. 1% is merely a statistical value to you, but that represents millions of lives killed needlessly (in the U.S. alone, potentially more Americans killed than in WWII). This is not a war where civilians should be drafted to die for the sake of your 401k; for the sake of Capitalism. We should take the unprecedented wealth of this country, stop pretending our jobs matter (those non-essential jobs which have been shuttered because of the virus), and use that excess wealth to give everyone healthcare, housing, and a universal basic income. It's time to shift this economy to the 21st century. Mother nature sent us to our room to think about what we've done. Trying to ""get back to normal"" misses the point entirely. We have to radically change our behavior as humans, and our economy. Now is the time.",Reader Picks,MO  
There isn't enough money? Great Britain is looking at paying people up to 80% of their salaries to stay at home. And here in the good ole USA we always seem to have enough money to fund war after war. We always seem to find enough money to cut taxes for the already filthy rich. After already previously cutting them again and again since Saint Ronnie. There is plenty of money. There is simply way too much of it concentrated in far too few hands.,Reader Picks,US
"Thanks, Mr. President, for refusing to act when first told in January of the virus being here. Thanks for calling it a 'democratic' hoax' and 'fake news' while the virus was starting to spread. Thanks for refusing the World Health Organization's testing kits, while the virus was spreading at an increasing rate. We are dead last in testing per capita, thanks to that 'decision'. Thanks for refusing to deploy our military to build hospitals, and refusing to act on the defense powers act to get critical medical supplies and equipment to our health care providers. Counties like South Korea, Japan and Singapore did the complete opposite. They acted right away, didn't lie to their citizens, and starting widespread testing quickly. They had their first cases on the exact day as we did, or within a few days, and today have the virus completely contained, with virtually no new cases, without shutting down their economies. We, on the other hand, have to go on complete lock down, and given how out of control the virus is spreading, will go on for months, if not the rest of the year. Your inaction's, stupid decisions, and constant lies are the reason. What's even more sickening and depressing is that almost 50% of Americans believe all your lies, and think you are doing a good job at handling this crisis.",Reader Picks,Colorado
Now they're holding their employees hostage and threatening mass layoffs if they don't get taxpayer's money. Never mind the billions they earned over the last 10 years; that's theirs to keep.,Reader Picks,
"No need to alter the approach except to protect known at risk individuals. Americans are incapable of following a directive, especially if it is mostly to benefit someone else. The bulk of the American people have voted selfishly for 40 years and they will act selfishly now. The best you can do is lockdown and then let what happens happen. It will pass fairly fast because Americans will continue to spread it fast. It will also kill a lot of people, but that is the American way, rugged and careless individuals that they are. Just kidding about the rugged part. No way you don't have 6-18 months of dire case loads and economic issues. The economy is not coming back anyway, because it was always fake and built on baby-brained consumers.",Reader Picks,PA
