comment ,pick,state
"I am deeply disturbed that politicians like Cuomo, De Blasio, and others and are adopting a ""eradicate coronavirus at any cost"" approach. They seem completely oblivious to the devastating consequences of the prolonged economic shutdown they are inflicting. Destroying millions upon millions of businesses and livelihoods is not a trivial matter and cannot simply be met with a shrug, as if eradicating a virus with a 1% (or perhaps lower) fatality rate can be society's only concern. Friedman is right--we need a balanced approach that balances risks and benefits of economic restrictions. We simply cannot have an indefinite/multi-month near-complete economic shutdown or the consequences will be much more severe to society than the coronavirus could ever inflict.",Reader Picks,NY
"You're spot on, TF. Put a dome of protection around high-risk people (and throw plenty of money at the effort) while letting low-risk people get back to work (and yes, likely get mildly sick). If this doesn't happen, then when exactly does the lock-down end? In 1.5 years when a vaccination becomes available? (Ending the lock-down sooner - without an effective vaccine - will simply restart the infection wildfire, right?) I don't think any of us will recognize the economy/society that awaits us if we put our economy in hibernation for the next 18 months.",Reader Picks,Maine
"First, there is no evidence that once someone has the virus and recovers from it they are then immune. It is irresponsible to suggest that, since it could be far from the truth. Second, the only way to solve this mess is with extensive testing. 80% of people get the virus from those who exhibit no symptoms. Only testing those who are already exhibiting symptoms is too little too late. EVERYONE should be tested and those who are positive are quarantined. Of course this would take a coordinated federal response and with the current level of ineptitude I have little faith that it will happen anytime soon.",Reader Picks,CA
"I find this article appalling when we are already dealing with people who think this is all a hoax. We cannot halfway shut down the country. The loss will be unbearable. There isn?t time anymore to try things or test out theories. There is no mitigating this disaster, we just need to give our medical professionals a fighting chance to live.",Reader Picks,Texas
"The only plan that makes any sense is keeping our social separation running as tightly as possible until we can below the rate new infections can be medically treated--no matter what the survival rate is with a fully functional medical system. We know that 10 to 20 % of all coronavirus patients need some hospital support. If we can't break the exponential growth with social distancing, we will have about 10% of 200 million people needing medical care in 40 days--about 20 million people. That is 20 million who can't get care. Until then, we need to pay everyone who has lost their job and hustle to ensure that utilities stay functional, food is grown, harvested, imported, and delivered. No evictions so our homeless population does not explode. Small business owners also need to be paid so shops can stay open with essential merchandise. The current plan to throw money at cruise ship operators and airlines is almost exactly wrong. How will those without work find food and pay for it? Our current unemployment system takes a few weeks to start to operate. Small business owners must be kept in business if recovery can be rapid. Every three days, the problem grows 2 times worse. Until the number of new infections each week is consistently less than the week before, our focus has to be on keeping us separate, fed, housed, and as healthy as possible. Nothing else.",Reader Picks,CA
"I hear Dr. Katz, but his approach has three flaws: 1. The horse is long gone from the barn whose door he?s talking about closing - the infection rate is growing every day because we failed to test from Day 1. 2. The approach assumes people will be able to stay home if they feel unwell - they can?t without paid sick leave and job security. 3. The approach requires a leader who can be trusted, who inspires confidence, and who assembles the most able team of experts and then actually listens to them and follows their recommendations - we got nuthin?.",Reader Picks,NY
"The Ioannidis-style ""herd immunity"" approach has a couple of problems. First, because this virus is not known, it is very risky to generalize how it will behave based upon experiences with other epidemics. Second, to get crude and crass -- but I have no idea how that's to be avoided when the kinds of things Mr Friedman proposes are proposed -- how many billions of dollars of GDP will you get per hundred thousand American fatalities? The 1918 Spanish Flu struck in 3 waves. The deadliest was the 2nd wave. Not only did getting and recovering from the Flu its first wave fail to confer immunity against the 2nd wave, there is evidence it made at least some patients more susceptible to infection and death, not less. We don't know much about immunity, antibodies, or vaccines for SARS-CoV-2. Without a notion of how permissive and pervasive we can be economically and how that translates into numbers of cadavers, we can't know if this would or will be a win. What is the tradeoff is 10 million Americans dead? 20 million? What Mr Friedman and what, implicitly, Dr Ioannidis are failing to consider is the possibility that SARS-CoV-2 might just be telling us our global economy is too fragile as presently constructed and needs to massively change. And despite the present President's wishful thinking, it's entirely possible that there is another pandemic like the present lurking around the corner. Surely, some experts have been saying that and Mr Friedman knows that.",Reader Picks,MA
"Mr Friedman: I have long enjoyed your books and thinking--but this time, OPPs! First problem: time horizon. With a 3 day doubling period, we had about 120 days to get to 200 million illnesses, enough for herd immunity. This also means that 3/4 of them get sick in the same week (the last 2 doubling periods), and will all be sick together. Because we have frittered away the first 80 of our 120 days from discovery, we only have 40 days to get the social distancing to push the infection rates down to a sustainable level. We need to get though the next 40 days and get social distancing established so we do not get overwhelmed. Perhaps 10 million American lives are in the balance. Once we have achieved stability (or just crashed), recovery can begin, getting money out to individuals who have lost jobs and small business owners as quickly as possible is probably the best way to get recovery going as soon as possible.",Reader Picks,CA
"Are you referring to elective procedures? Yes, those are being canceled. Not the same as live saving treatments such as chemotherapy. Just had one of my patients admitted to the hospital for GI bleeding.",Reader Picks,MA
"If an innovation is economically efficient, it's absolutely affordable to pass on a share of the savings to the displaced workers. If not, we should expect shortages: what young person would spend the time to get a CDL at the point when they expect to be replaced by self-driving vehicles in under a decade? But we'll still need shipping during that decade. Letting those workers know that they won't suddenly be completely without support would help bridge that gap.",Reader Picks,NY
The best hope for rescuing our economy is through actual leadership and acting to save lives. The best hope for rescuing our economy is to recognize that the economy serves the purpose of not letting people die. 'Saving the economy' by letting massive numbers of people die isn't saving anything. It's an abandonment of all the principles for why we even have an economy.,Reader Picks,ID
"If we ""flatten the curve"" by completely shutting down the entire country for twelve to eighteen months, we're going to have a problem even more lethal than the virus: an economic depression so severe it will trigger a civil war or WWIII. (Remember, the Great Depression laid the foundation for WWII.) Also, if you haven't noticed that our country is already in danger of a violent civil war, you haven't been paying attention these last few years.",Reader Picks,CA
"A look at some of the best available evidence today, though, indicates it may be 1 percent and could even be lower. ?If that is the true rate,?? Ioannidis wrote, ?locking down the world with potentially tremendous social and financial consequences may be totally irrational."" Have you seen Italy? They don't know where to put all the coffins. And they are one fifth our size.",Reader Picks,DC
"Mostly agree. However, getting to ""herd immunity"" by not practicing social distancing means the number of those with the virus doubles every 3 days. Taking our current number of caes and running up to a total of 200 million (the number needed to establish herd immunity) means the in the last 6 days of the big buildup, 3/4 of 200 million get Coronavirus at once. Given the 10% who will need hospital attention, there will be a need for about 20 million hospital bed with a sizable fraction requiring ventilators. Casualties just from lack of ventilators would be in the millions. Because most of the casualties come in a week or so, the shock to the system would ensure far more casualties. If we stopped social distancing today, the time to the maximum cases and huge overload and vast die-off is about 40 days from now.",Reader Picks,CA
"Adult able bodied Americans who are not in the high risk group or can work from home or are on social security should stay out of the way of those who want to work and can work and are not afraid to work. Yes the economy and public health are at stake if we are all going to live in a bubble. Had enough of the grand standing politicians trying to play god and to do as they please to take advantage of the COVID-19 crisis to order citizens to stay in a bubble. If every one had a severe combined immunodeficiency like the bubble boy then I would say makes sense, everyone stay in the bubble on the moon but only a minor percent of adults have a weaker immune system due to being a baby boomer or being 75+ or having AIDS or a smoker or genetic deficiency or diabetes and should self isolate and work from home. The rest of the adults should be allowed to get back to work and get back to their activity. I just told the CEO Steve of Kentucky YMCA please don't keep my Y closed beyond the next weekend after keeping the safety precautions are in place and social distancing gets implemented. Schools and colleges are closed and can continue to remain closed. Low lying fruit has already been picked and now the tough part has come to get all essential and emergency services can be brought to life and full swing. Throwing money at the problem will not make the problem disappear. Never has, never will. Conditions have to be created to get Business as usual. CA, NY and WA need to plan smart.",Reader Picks,KY
"The U.S. needs to ramp up testing to the extent where nearly every person is tested. We will then be able to identify the asymptomatic infected. After 2-3 weeks, those people can resume normal activities, and the economy can begin to rebuild itself.",Reader Picks,NY
"the pump is primed"" is itself a product of the New Deal referring the Keynesian economic stimulus. Please note that the US had a chance to go socialist after the war and chose instead to go all out capitalist. People just need some safeguards which the right has fought tooth and nail against. But the right has never come up with better approaches to helping people. I call that a failure to invest in human capital.",Reader Picks,MA
"The numbers just don't add up, Thomas. Let's low-ball and say that the per-capita death/hospitalization rate for Covid-19 is only double that of the flu, if vulnerable populations are isolated. Then factor the higher infection rates, which are at least twice as high as for the flu (conservatively). Multiply the relative infection rate (vs. flu) by the relative hospitalization rate, and you have at least 4 times the number of hospitalizations vs. flu, which will overwhelm our medical system. Just going ""back to normal"" in two weeks would result in a massive increase of infections, ironically resulting in higher mortality rates among the vulnerable population, who would be in competing with Covid cases for scarce care facilities.",Reader Picks,MA
"We must all be grateful to Mr. Friedman for citing a trifling two sources to justify a strategy that does more good for business than it does for anyone else. The Fat Cats always cry foul at anything whatsoever that disrupts their bottom line. As a Washingtonian, I can remember when the nuclear power industry constantly cried out that, without their reactors, the entire state would be condemned to frequent brown-outs. When the reactors didn't prove profitable, the reactors were dismantled--and the brown-outs didn't happen. Mr. Friedman will have to forgive me for being skeptical of any claim that sounds like a billionaire's fondest dream. By the way, where are America's old people supposed to be sequestered? In internment camps, perhaps? So that they can all be together to make each other's infections worse? If we build and fill the camps, will they become places where old folks are encouraged to go ahead and die already? After all, they aren't in the spend-most demographic of 18-35 years of age, so what value could their lives possibly have?",Reader Picks,Washington
"I suggest Mr. Friedman read ""I?m 26. Coronavirus Sent Me to the Hospital"" which can be found elsewhere in the NYT & then revisit the subject of letting the supposedly young and healthy back on the streets. Or perhaps he would like to change places with her.",Reader Picks,Ohio
"Great to see a thoughtful and reasoned different approach to this incredibly challenging situation! I believe your proposed approach is correct, but the only problem is that it requires intelligent, thoughtful, leadership from people more concerned with the country than themselves... and those people are in short supply in DC.",Reader Picks,OR
"If it?s true that the hospitality- tourism industry accounts for 10% of jobs and 8% of GDP, and people aren?t going to flock to websites or travel agencies to book exotic (or less exotic) vacations due to the fear of getting the virus from someone who hasn?t been locked down for two weeks, then it would seem that a 10% contraction of the economy is going to be difficult to unwind. Similarly other sectors of the economy would appear to be damaged long beyond a few weeks, let alone a few months. So 20% contraction seems possible - a severe blow to many. The first three stages of grief are 1) denial, 2) anger, and 3) bargaining. While Trump vacillates between 2 and 3 now, after spending a few months mired in 1), his base is most likely still mostly in 2) because that?s where they like to reside, in good times as well as bad. Friedman?s approach is more a 3) since it might involve bargaining away lives in order to prop up the economy. At some point, the terror of accepting that things have been fumbled badly by Trump and his enablers due to stubbornness will lead to the enduring of the pain of the loss of thousands of lives, whether statistically significant or not. The acceptance and grieving phases will be difficult for mature Americans, more so than those for whom compassion is to be avoided, or denied. To be stuck in 1) or 2) is to live without liberty. The bottom line is that the virus is now ?in control?, not Trump, no matter what he proposes to do.",Reader Picks,"Raleigh, NC"
"None of this would have happened had Donald Trump not completely ignored and lied about his January briefings on the emergence of a dangerous coronavirus in Wuhan, China. It took HHS Secretary Azar more than two weeks to try to speak with Trump about the virus after his January 3rd briefing -- and once Trump took notice, he lied to the American public and only acted to personally benefit his campaign rather than act in the interests of the public. We in the USA could have taken the Taiwan approach of large-scale testing of people for the virus and contact tracing, but the prevarication and delays of Trump and his GOP sycophants prevented that less deadly approach. At this stage, we still would need the large-scale testing --which Trump has refused to support and lend federal resources to -- and contact tracing. As we do not have that, it will take more than two weeks of home sheltering to reduce the mortality and morbidity to a level that will not overwhelm hospitals.",Reader Picks,MA
"With the current lack of leadership, no one is going to insist on a two-week quarantine period across the country, even though both experts and many lay people agree with it. I had that conversation not an hour ago with a friend. She's in her 60s and has an autoimmune disease. I'm in my 70s and have asthma. We see kids congregating in large groups on our beaches. Leadership is lacking at the local level here and at the national level, so there is every chance that thousands if not tens of thousands more will die in the coming weeks, simply due to people being unwise or unwilling to stay home except for necessities like food and water.",Reader Picks,SC
"""These are days that test every leader ? local, state and national. They are each being asked to make huge life and death decisions, while driving through a fog, with imperfect information, and everyone in the back seat shouting at them. My heart goes out to them all."" Thank you for stating the obvious, which so many unfortunately refuse to see. Please make sure all your colleagues read this. This is the time to support all the people, Republicans and Democrats, who are in positions in power. There will be plenty of time to bash them all once this passes. This is a crisis - behave.",Reader Picks,Florida
"Everything you wrote makes sense but so much is riding on whether or not individuals and companies act responsibly. Retail workers are complaining about lack of hand sanitizer and masks and many are choosing to report to work even if they are sick. ?Wages at Target start at $13 an hour, and employees often have a hard time getting more than 20 hours of work each week. Many are not offered health insurance through the company. All of which leaves employees facing a hard decision: If they feel a cold coming on, or if they were in contact with someone who was confirmed to have the coronavirus, many say they have no choice but to keep working.? The response by companies like Amazon is to hire 100,000 employees to account for workers who are too sick to come to work. ? Not all of the hiring is being done to simply meet demand. Employers are also bracing for when their workers get sick with the virus or are simply no longer able to get to work, and are planning accordingly. ?Some of our hiring is to manage risk, too,? Mr. Vanderelzen of Lineage Logistics said. ?We expect that some people will be quarantined or have to leave because of the virus.?",Reader Picks,NY
This seems like a game of Russian roulette . If we had leadership and time could this be considered. Manufacturing needs to return We could employ everyone Why aren?t we using all these 3D printer companies and employing massive amounts of people to make protective products for the front line Now and for the vulnerable in the future And rethink sanitary standards everywhere,Reader Picks,Texas
"Oh look, a column by Friedman arguing for returning to the status quo as quickly as possible no matter the potentially dire consequences. How shocking.",Reader Picks,NJ
"Everyone above age 65 and/or with existing health conditions should be required to stay home. Let everyone else get back to work. We are basing our estimates on skewed testing mainly performed on the already sick, hence the dramatic numbers and increases, which simply reflect increased testing, not much else. A nationwide poll would be the only way to get exact numbers regarding the percentage of infected and mortality rate. This global shutdown seems many times more dangerous than corona itself.",Reader Picks,NY
"Economics is not a science. Economists are not scientists. There are too many variables and unknowns to craft the double-blind/ randomized controlled experimental tests that provide predictable and repeatable results that are the essence of science. America is not a business. America is a nation state. The President of the United States is not a businessman. The President of the United States is the head of government and state. There is no science in politics or any of the other social sciences for the same reasons. Any more than there is any science in history and law. Calling anyone an economic or political ' expert' is no more convincing and credible than calling any accountant, banker, charlatan, fortune teller, historian, journalist, lawyer, oracle, preacher, politician, psychic, or soothayer an 'economics expert'. There isn't a Nobel Prize in Economics Science. There is the Swedish National Bank Prize in memory of Alfred Nobel. Past economics performance is no reliable indicator of future economic performance is the legal disclaimer of liability.",Reader Picks,IL 
"We should be taking this time to understand the disease so we can make intelligent decisions on how to create a new normal for everyone. A surgical restart to getting everyone back to work helps the whole society and we need to protect our most vulnerable. We all have friends and family we want to protect, so it?s in our own best interest to protect them. But that doesn?t mean we slowly destroy the rest of society. The government needs to give us better facts so we can make better decisions. The role of government is to protect all its citizens. If it doesn?t then it fails. Right now the government is failing.",Reader Picks,NY
"His plan would still swamp and choke the hospitals, wouldn't it? How does that help?",Reader Picks,
"Thank you Thomas. As an old vulnerable guy have been rather loudly (through my tiny megaphone) advocating shutting things down as firmly as possible. Look at China. How relatively unscathed even though they were ground zero. Now believe I was very wrong and Dr.Katz is very right. So thankful that you are, far more eloquently than I could, advocating this, or at least seriously considering this approach, through your much larger megaphone. Continuing the current world-wide suppression approach is going to lead, I believe, to untold economic disaster and may wind up saving no lives at all. Isolating everyone over 60 or even over 50 and letting the remaining 3/4ths of the world get on with their lives seems a much better approach. The question is, is there any chance the rush to suppression can now be reversed?",Reader Picks,NJ
"The legislators themselves were fiscal toddlers: first throwing our tax money at businesses instead of investing in much needed infrastructure etc. The blame for our inadequate response and our need for monetary juggling now starts with the Republican dominated Congress and their infinite belief in the ethical perfection of business and business leaders. They have seen and been told innumerable times about the behavior of business to infusions of government money with no strings attached and yet they believe that business with millions at their disposal will not think of themselves first. But individual citizens with a mere $1500 will squander it! This is how ?an ideology? makes idiots of anyone on the Left or the Right. In this case, mostly on the Right and in charge politically. Wait till we see the botch job coming down the pike from our Conservative dominated courts. We ain't seen nothing yet.",Reader Picks,NYC
"Either we let many of us get the coronavirus, recover and get back to work ? while doing our utmost to protect those most vulnerable to being killed by it. Or, we shut down for months to try to save everyone everywhere from this virus ? no matter their risk profile ? and kill many people by other means, kill our economy and maybe kill our future."" Your and Dr. Katz's ""Either/Or"" proposal is guess-based and not data-based. It is riddled with known/unknowns and unknown/ unknowns. Donald Rumsfeld would be proud of you and Dr. Katz for using flawed and twisted logic rather than proven data (which is currently unavailable) to design such a life-altering plan while criticizing plans based on best available Coronavirus data.",Reader Picks,Texas
The flaw in comparing the pandemic with a terrorist attack or a hurricane is that those disasters were not contagious.,Reader Picks,COL
"Restarting our economy prematurely may soften the crash, but Singapore and South Korea went much longer than 2 weeks of suppression before they began opening back up. We can't rely on good behavior by enough of the public to prevent a second and third wave of infections after stopping stay-at-home. Tom if you haven't seen it recommend you read https://medium.com/@tomaspueyo/coronavirus-the-hammer-and-the-dance-be9337092b56 . The hammer part of that approach is much longer than two weeks, acknowledging that the economic damage will be great. Unless we box in the pandemic, the economic damage will be a secondary consideration.",Reader Picks,CA
